,title,summary,image_link,link,genre
127,First person of color confirmed as permanent Census Bureau director,"The Senate voted on Thursday to confirm Robert Santos as director of the Census Bureau, making him the first person of color to hold the position in a permanent capacity. Santos, who is Mexican American, was confirmed in a 58-35 vote. Ten Republicans joined Democrats in voting to confirm him. Santos ""is an expert in survey sampling, survey design and more generally in social science/policy research, with over 40 years of experience,"" the White House said in a statement at the time of his nomination. He currently serves as vice president and chief methodologist at the Urban Institute, a nonprofit research organization.President Joe Biden's selection of Santos had followed a turbulent year at the Census Bureau after the coronavirus pandemic hit just as the massive once-a-decade effort to count the US population was getting underway and scrambled the agency's plans.The census, which happens every 10 years, determines how many representatives each state gets in Congress, and how billions of dollars in federal funding is spent. Schools, roads and other important things in your community will gain -- or lose -- funding over the next 10 years depending on this official population tally. The most recent count was mired in political controversy following the Trump administration's drive to compile citizenship data and use it to the benefit of Republicans in an effort experts called unprecedented. Former President Donald Trump had specifically attempted to exclude undocumented immigrants from being counted when seats in Congress are divvied up between the states.Biden issued an executive order on his first day in office requiring non-citizens to be included in the Census and apportionment of congressional representatives. He rescinded the Trump-era policy saying that it ""conflicted with the principle of equal representation enshrined in our Constitution, census statutes, and historical tradition.""California Democratic Sen. Alex Padilla, the son of a cook and house cleaner who immigrated from Mexico, tweeted about the confirmation, saying in part, ""Great news! We just confirmed Robert Santos as Director of the Census Bureau—the first Latino to hold the position permanently. An accurate census is critical to our democracy & economy.""Santos' term is set to last five years and expire on December 31, 2026.CNN's Paul Leblanc contributed to this report. ",//cdn.cnn.com/cnnnext/dam/assets/211104154547-robert-santos-file-restricted-small-169.jpg,https://edition.cnn.com/2021/11/04/politics/robert-santos-census-bureau-director-first-person-of-color/index.html,politics
128,White House aide who tested positive for Covid-19 during foreign trip remains in Scotland,"A White House official tested positive for Covid-19 during President Joe Biden's foreign trip and is now quarantining in Scotland, another White House official confirmed Thursday. The aide, whom the White House is not identifying out of privacy concerns, tested positive on Tuesday -- Biden's last day attending the global climate summit -- ""although additional tests to date have been inconclusive.""""This individual did not have close contact with the President and is not exhibiting any symptoms,"" the separate White House official said. ""The person has remained in Scotland to complete the quarantine period with the support of the administration.""The White House also had several staff members who had close contact with the person who tested positive travel separately back to the United States. ""All close contacts tested negative via PCR upon arrival in the United States. Additionally, the President tested negative on Tuesday,"" the separate official said. The news comes after high-profile members of the Biden administration tested positive for the virus in recent weeks.White House press secretary Jen Psaki had dropped off of Biden's international trip last week after members of her household tested positive for Covid-19. Shortly afterward, Psaki announced she herself had tested positive. She said in a statement on Sunday that she was disclosing the positive test result ""out of an abundance of transparency,"" adding that ""thanks to the vaccine,"" she was experiencing only mild symptoms and was working remotely.Homeland Security Secretary Alejandro Mayorkas tested positive last month, forcing him to work from home instead of traveling to Bogota, Colombia.Biden and his administration are urging Americans to get vaccinated. ""Later this month, our tables and hearts are going to be filled, thanks to the vaccines,"" Biden said on Wednesday while addressing the news that the US Centers for Disease Control and Prevention had authorized the Covid-19 vaccine for children ages 5 through 11. ""We've made incredible progress over these past nine months, but we have to keep going.""This story has been updated with additional background. ",//cdn.cnn.com/cnnnext/dam/assets/210704190844-white-house-exterior-0703-small-169.jpg,https://edition.cnn.com/2021/11/04/politics/white-house-aide-tests-positive-covid-foreign-trip-scotland/index.html,politics
129,Harris looks to strengthen US-France ties in 'concrete ways' on Paris trip,"Vice President Kamala Harris will pursue US efforts to strengthen a recently mended French-American relationship during a trip to Paris next week, where she will also attend a pair of international conferences.Harris will sit down for a bilateral meeting with French President Emmanuel Macron at the Élysée Palace next Wednesday before delivering remarks at the Macron-hosted Paris Peace Forum and participating in a multilateral conference on Libya. Harris' trip comes less than two months after France temporarily recalled its ambassador to the US to protest a US nuclear submarine deal with Australia, which sank a separate French contract to build conventional submarines for Australia. President Joe Biden last week sat down with Macron on the sidelines of the G20 summit in Rome and acknowledged that the US had been ""clumsy"" in its handling of the matter. ""The key message for this meeting is the importance of this relationship and the fact that US-French partnership matters to the world,"" a senior administration official said of the Harris-Macron meeting. Harris will be the most senior American official to attend the Paris Peace Forum since it was launched in 2018, though senior administration officials declined to say whether her attendance was part of an effort to mend the US-French rift. The senior administration official said the Biden administration is ""forward-looking"" in its relationship with France and that Harris will look to strengthen French-American cooperation ""in concrete ways,"" though the official declined to say specifically how Harris would seek to improve the relationship. The official said Harris and Macron plan to have a ""wide-ranging discussion across a range of issues to include the bilateral relationship, European security, the Indo-Pacific, global health, space and a number of other subjects."" A second senior official said Harris' remarks at the Paris Peace Forum on November 11 -- which will focus this year on global health and post-Covid recovery --  will address ""big, converging global crises"" with a focus on ""the challenge of rising inequality and the need for leaders around the world to join together and take bold action."" Harris will join Macron and other world leaders for a dinner following the forum. She is set to arrive in Paris on Tuesday and return to the US the following Saturday. Officials said Harris will tour the Institut Pasteur, a biomedical research institute, after her arrival and meet with French and American scientists working on Covid-19 and pandemic research. Harris will visit the Suresnes American Cemetery, just outside of Paris, on the eve of Veterans Day and participate in an Armistice Day ceremony the following day, visits intended to demonstrate ""the years that France and the United States have stood together, our shared values and our commitment to continue doing the right things together around the world,"" the first senior administration official said. On November 12, Harris will participate in an international conference on Libya alongside 20 heads of state and government, including Macron, German Chancellor Angela Merkel, Italian Prime Minister Mario Draghi and UN Secretary-General Antonio Guterres. ""The vice president is attending to show US support for the Libyan people as they work to reestablish their sovereignty and establish lasting peace,"" the second senior administration official said. ""We want to show our support for the Libyan people as they move towards national elections and as they focus on the importance of the withdrawal of foreign forces and mercenaries and fighters.""  The official said Harris will also express ""deep concern for human rights and the situation of migrants and refugees."" ",//cdn.cnn.com/cnnnext/dam/assets/210614180815-kamala-harris-small-169.jpg,https://edition.cnn.com/2021/11/04/politics/kamala-harris-trip-paris/index.html,politics
135,Biden administration rescinds Trump-era policy limiting migrants at legal ports of entry,"The Department of Homeland Security has rescinded a Trump-era policy limiting entry of undocumented immigrants at legal ports of entry and released new guidance on the process, according to a recently-released memo.Migrants seeking asylum can present at ports of entry to make their claim, but under the Trump administration, DHS put in place policies limiting the processing of undocumented immigrants, including asylum seekers, at ports. The practice, known as ""metering,"" essentially created a waitlist to allow people to enter only if the department had the capacity to process and detain them at one of its facilities. The latest memo, dated November 1, rescinds that policy, but migrants could still be expelled under a Trump-era public health order allowing the swift removal of migrants encountered at the US-Mexico border. ""This memo formally rescinds the Trump Administration's 'metering' policy, which was used to turn back asylum seekers trying to enter ports of entry (POE). The new guidance lays out a vision for the lawful, orderly processing of individuals applying for asylum at POEs. Among other improvements, CBP is directed to accelerate ongoing efforts to digitize processing at POEs and more effectively use data to increase throughput,"" US Customs and Border Protection said in a statement. Limiting entry of asylum seekers at legal ports of entry under the previous administration fielded criticism from immigrant advocates and attorneys who argued it denied asylum seekers the right to pursue their claims. A 2020 Homeland Security inspector general report also found that CBP staff turned away asylum seekers at some ports of entry and in some cases, that led asylum seekers and other undocumented immigrants to cross the US-Mexico border illegally. The Monday memo, from acting CBP Commissioner Troy Miller, now directs Office of Field Operations management along the US southern border ""to consider and take appropriate measures, as operationally feasible, to increase capacity to process undocumented noncitizens at Southwest Border POEs, including those who may be seeking asylum and other forms of protection."" It also notes that other priorities, like facilitating trade, should be considered when processing undocumented immigrants.Those measures could include using a mobile application where undocumented immigrants can submit information and collaborating with non-governmental organizations and other partners. Port of entries ""must strive to process all travelers, regardless of documentation status, who are waiting to enter, as expeditiously as possible, based on available resources and capacity,"" the memo reads.DHS is also preparing to reopen the nation's land borders for Covid-19 vaccinated foreign nationals next week after travel was restricted due to the coronavirus. ",//cdn.cnn.com/cnnnext/dam/assets/211103082159-del-rio-texas-border-entry-09-22-2021-small-169.jpg,https://edition.cnn.com/2021/11/03/politics/migrants-legal-ports-of-entry-biden/index.html,politics
140,"TV OT: Is TLC the weirdest network on TV? Plus, revisiting the fall's 'Big Leap' into less-'Ordinary' series ","Welcome to November. Insert your screams here. Enjoy this week's TV OT: Is TLC the weirdest network on TV?Although I generally prefer to keep my blemishes covered under layers of well-blended concealer, there's a public pimple I must pop in the name of transparency: Over the years, I have watched a lot of TLC. I'm someone who generally believes there should be no such term when talking television as ""guilty pleasure"" because you should not be ashamed of what brings you comfort. But I can't say that watching ""Sister Wives"" (returning Nov. 21) or ""My 600 lb. Life"" (new season airing now) or ""So Freakin' Cheap"" brings me anything resembling pleasure, but I can't stop. In that lies the mystery of what I'll now controversially say is television's weirdest and most fascinating network. Unlike streaming networks, which can bury their junk and still win awards for its prestige content or broadcast networks that have to worry deeply about offending any of their increasingly fewer viewers, TLC lives in their crud. Heck, they often celebrate it. (For the sake of this discussion, I'll make one quick point: I won't get into the network's utter failings in the handling of anything relating to the Duggars, but it is part of why I struggle with watching TLC period.)This is where I should point out that like any network, TLC has some range. For example, it has given a home to the inspiring story of transgender teen Jazz Jennings. ""I Am Jazz,"" entering its seventh season this month, has done volumes for bringing awareness to the challenges of being young and trans -- something that is arguably (and sadly) more needed now than when it premiered. The baffling part of TLC is that its spectrum has such an applaudable high and multiple in-the-bowels-of-television lows, of which I won't dare to pick the most objectionable. Though, if it was still on the air, it'd be the show where I once watched the story of a man who was in an intimate relationship with his car.  I know I'm not alone in watching any of it, though. TLC's ""90 Day Fiancé,"" franchise is a crazy success. (But one friend who used to watch it told me she stopped because the two-hour episodes and constant spin-offs was too much to keep up with) In a time when networks have a small stable of reliable performers, TLC has multiple shows that have been on for 6-plus seasons. (""Little People, Big World"" wrapped up Season 22 earlier this year.) And one of its newer shows, ""Dr. Pimple Popper,"" is so popular, it's getting a Christmas Special — subtitled ""A Pimple Carol."" ""It's unlike any other programming on TV right now,"" says one friend, who spoke on a condition of anonymity and we all understand why. ""It's against social norms. We don't have a lot of drama in our lives, but we watch it on TV."" This one half of a married couple says they've watched everything from ""90 Day Fiancé"" to ""Extreme Sisters,"" a series that explored sisters whose close bonds veer into baffling territory.  The other half of the couple adds: ""It's a world you just don't know. You get sucked in.""  And maybe that the secret? TLC is the television equivalent of a highway car crash that you can't look away from. The loudest objection I hear to TLC programming is that it can feel exploitative and often mean in spirit. But I'd argue we are all accountable for our own reactions to the stories we see in the same way the participants are accountable for agreeing to be featured. Do I judge weird couples? Yes. But do I also cry watching ""My 600 Lb. Life""? Absolutely. And did everyone featured on any of these shows knowingly sign up to be on TV? Definitely. TLC hasn't been The Learning Channel for a long time, to the disappointment of many. But they've found success, perhaps, in deciding that there was an audience for Television that Loathes the Conventional.  Revisiting the fall's 'Big Leap' into less-'Ordinary' seriesNow, tossing it over to Brian Lowry with a mid-fall TV update. ""One of the problems reviewing series that have slightly more ambition than 'FBI' spinoffs is the question of whether a frontloaded couple of episodes can actually be sustained over the course of a season, much less multiple seasons.Happily, three network shows that earned the most favorable reactions when they made their debuts this fall -- ""The Big Leap,"" ""Ordinary Joe"" and 'Ghosts' -- continue to hold up quite well.Fox's 'Big Leap' might be the most impressive of the bunch, finding clever layers as it combines the characters -- participating in a fictitious reality-TV dance show -- in unexpected ways. It's consistently sweet, funny and fairly smart about how the reality sausage gets made, with Scott Foley shining as the amoral producer who'll step over pretty much anyone in pursuit of a second-season renewal.NBC's 'Ordinary Joe,' meanwhile, has built on its pilot with details about the central character, played by James Wolk, following him on three separate paths diverted by one decision he made at a crucial point in his life. A little strained at times, it remains a feat of editing and has steadily dropped new tidbits to expand the story.Finally, 'Ghosts' has stood out as a non-cookie-cutter comedy for CBS, with a couple moving into a house inhabited by ghosts from different eras. Although it has the benefit of being adapted from a British show, that's no guarantee of durability on a more expansive US TV schedule, which the show has thus far exhibited.All told, it's an encouraging sign for the major networks, which at times have appeared willing to ride their existing franchises ('Chicago' everything, 'Law & Order,' etc.) into a steady march toward oblivion.These new shows suggest there's life in the model, especially if you'll take a few creative risks to expand it.""'Class' dismissedFor your weekend watch list, here's Lowry again with a recommendation. ""OK, we get it, established intellectual property is all the rage, but the new 'Head of the Class' revival, on HBO Max (like CNN, a unit of WarnerMedia), feels more peripherally tethered to the mildly memorable show that preceded it than most.Here, Isabella Gomez (a veteran of the 'One Day at a Time' revival) plays the slacker teacher to a group of high-achieving kids, in a series that feels as generic as that sounds. Despite the fresh faces, there's little to distinguish this from a network sitcom in the 1980s.As for connections to the original, Robin Givens shows up in a subsequent episode, which is nice.In terms of making us look with the title, mission accomplished. Making us stick around is another matter.""A 'Symbol'-ic gestureAnd another from Lowry: a programming note for the Peacock-less.""NBC developed 'The Lost Symbol,' based on Dan Brown's Robert Langdon character, for the network, then decided to premiere the series on its streaming service, Peacock. Now the show is getting a one-time showing on NBC in place of an 'Ordinary Joe' repeat.It's a small thing, but the synergistic move is another example of the juggling act that studios face as they consider where their shows will fare the best. Frankly, 'Lost Symbol' might have been a long shot in any venue, but like 'Head of the Class,' it probably would have looked more at home on a broadcast network in the first place.""",//cdn.cnn.com/cnnnext/dam/assets/211105134628-90-day-fiance-tlc-small-169.jpg,https://edition.cnn.com/2021/11/05/entertainment/what-to-watch-tlc-big-leap/index.html,entertainment
141,UB40 founding member Astro dies following short illness,"British vocalist and founding member of UB40 Terence Wilson, better known by his stage name Astro, has died after a short illness, his current band confirmed.""We are absolutely devastated and completely heartbroken to have to tell you that our beloved Astro has today passed away after a very short illness,"" a statement on Ali Campbell and Astro's Twitter account said on Saturday. ""The world will never be the same without him.""Wilson was part of British reggae band UB40 for more than 30 years, before leaving the band to join breakaway group UB40 featuring Ali Campbell and Astro in 2013.UB40 formed in Birmingham in the late 1970s, and over the next three decades found success with hits including ""Red Red Wine"" and ""(I Can't Help) Falling In Love.""The band dealt with social and political issues head-on in their songs, giving voice to working class dissatisfaction with the status quo of the time.""I went through the same rigmarole as most black people in the late 70s,"" Astro told The Guardian in May, remembering the ""sus law"" that allowed the ""weekly occurence"" of police arresting people who were deemed to be acting suspiciously -- often on racist pretexts.  ""We found it harder to write love songs than militant lyrics, because it was a lot easier to write about stuff you had witnessed or read about. It seemed natural to us,"" he said.The current iteration of UB40 also paid tribute to the musician, writing on Saturday: ""We have heard tonight, the sad news that ex-member of UB40, Terence Wilson, better known as Astro, has passed away after a short illness. Our sincere condolences to his family.""Another of the band's founding members, Brian Travers, died of cancer in August at the age of 62.",//cdn.cnn.com/cnnnext/dam/assets/211107085325-01-astro-terence-wilson-small-169.jpg,https://edition.cnn.com/2021/11/07/entertainment/astro-terence-wilson-intl-scli-gbr/index.html,entertainment
142,'You's' Joe Goldberg seems to have found his next obsession in Cardi B ,"Things just got creepy, okurrr!Cardi B took to Twitter to share a letter and a hat from Penn Badgley's character Joe Goldberg from ""You.""""Hello, you... My stalking and killing may make me a certified freak, seven days a week, but it also brought me to... you,"" he wrote. ""Cardi B, you have a way with social media. You're meaningful. Substantive. I just like you,"" the letter continued. ""You're authentic and nuanced ... just as you are with your music. You keep me on my toes, the ones that are left, at least. You can't be caged in and it's refreshing. Can't wait to see you slaying in this hat, but I certainly hope you don't disappear.""The rapper captioned the photo writing, ""How Joe found my new house adress (sic).This comes after the stars switched Twitter profile pictures last week. In other Cardi B news, she tweeted that she would love to officiate Kal Penn's wedding after he tweeted that he had a dream that she presided over his upcoming wedding to his longtime partner, Josh.Penn seemed pretty excited about the offer.""We're down if you're down!"" he wrote back.",//cdn.cnn.com/cnnnext/dam/assets/191220092254-you-netflix-small-169.jpg,https://edition.cnn.com/2021/11/06/entertainment/cardi-b-penn-badgley-you-letter/index.html,entertainment
