,title,summary,image_link,link,genre
76,Sudan Fast Facts,"Here's a look at Sudan, a North African country bordering the Red Sea, Egypt, Libya, Chad, Central African Republic, South Sudan, Ethiopia and Eritrea.  About Sudan(from the CIA World Factbook)Area: 1,861,484 sq km slightly less than one-fifth the size of the United States.Population: 46,751,152 (July 2021 est.)Median age: 18.3 yearsCapital: KhartoumEthnic groups: unspecified Sudanese Arab (approximately 70%), Fur, Beja, Nuba, FallataReligion: Sunni Muslim, small Christian minorityUnemployment: 19.6% (2017 est.)Other FactsSudan was the largest country in Africa prior to the secession of South Sudan in 2011. It is now the third largest, after Algeria and the Democratic Republic of the Congo.Sudan lost most of its oil reserves, estimated to be between five and seven billion barrels, when South Sudan seceded. The United Nations has called the Sudan/Darfur conflict one of the worst humanitarian crises in the world. Between 2003 and 2008, at least 300,000 people were killed, and three million displaced.More than 58,000 refugees have fled Ethiopia into Sudan since November 2020, after the Ethiopian government began carrying out a military campaign in its Tigray region (as of October 31, 2021).READ MORE: Climate change could render Sudan ""uninhabitable.""Timeline1955 - Prior to Sudan's independence, conflict breaks out between Muslim Arabs in the north and Christian/Animist Africans in the south.  January 1, 1956 - Sudan gains its independence after an agreement between the United Kingdom and Egypt.1972 - Seventeen years of civil war end with the signing of the Addis Ababa Agreement between the north and the south. 1977 - Oil is discovered in southwestern Sudan. Civil war in the 1980s and 1990s prevents much exploration or development of the oil deposits. 1980s - Prolonged droughts put pressure on water and farming resources.1983 - Col. John Garang de Mabior leads a mutiny of army soldiers, reigniting the civil war. June 30, 1989 - Lt. Gen. Omar al-Bashir seizes power in a coup. August 12, 1993 - The United States designates Sudan as a state sponsor of terrorism.October 1993 - Bashir becomes president of Sudan when the Revolutionary Command Council is dissolved, and Sudan is restored to civilian rule.March 1996 - Bashir is reelected president with over 75% of the vote.December 2000 - Bashir is reelected president with over 85% of the vote.February 2003 - The conflict in Darfur begins when black African rebel groups attack government property, accusing the government of neglecting Darfur in favor of the Arab population in Sudan.2005 - A comprehensive peace agreement is signed by representatives from the north and the south. Part of the agreement includes independence for southern Sudan within six years.July 14, 2008 - The International Criminal Court (ICC) files genocide charges against Bashir.March 4, 2009 - The ICC at The Hague issues an arrest warrant for Bashir for a five-year campaign of violence in Darfur. April 26, 2010 - Sudan's National Election Commission certifies Bashir as the winner of recent presidential elections with 68% of the vote. July 2010 - The ICC issues a second arrest warrant for Bashir. The warrant adds three new counts of genocide to the 2009 warrant. February 7, 2011 - The Southern Sudan Referendum Commission announces that 98.83% have voted for separation from the north. US President Barack Obama declares Washington's intention to recognize South Sudan as an independent state in July, when the Comprehensive Peace Agreement is scheduled to end.February 21, 2011 - A party official announces that Bashir will not seek reelection when his term expires in 2015.April 27, 2011 - In a speech on state television, Bashir claims the disputed oil-rich region of Abyei on behalf of the north.May 22, 2011 - The United Nations condemns the violence over the oil-rich region of Abyei after multiple clashes between southern Sudanese forces and the northern Sudanese Armed Forces.May 31, 2011 - The African Union announces that Sudan and South Sudan have reached an agreement over Abyei, in which a demilitarized, jointly monitored Common Border Zone is established.June 5, 2011 - Fighting between the northern Sudanese Armed Forces and the Sudan People's Liberation Army of southern Sudan erupts near Kadugli, the capital of Southern Kordofan state. The UN also reports violence in neighboring Blue Nile and African Unity states.June 15, 2011 - The United Nations says that 102,000 people have fled from the disputed region of Abyei.June 20, 2011 - Representatives from Sudan and South Sudan sign an agreement calling for the immediate withdrawal of Sudanese troops from Abyei and for joint supervision of the disputed region.July 9, 2011 - South Sudan becomes an independent state, with a population of eight million people. July 12, 2011 - Bashir announces economic austerity measures in a speech to parliament. He also details plans for a new constitution, new currency, and greater political freedom. September 8, 2011 - According to UN officials, the governments of Sudan and South Sudan reach an agreement that will allow the withdrawal of their troops from the disputed border region of Abyei.October 2011 - In his first visit to Khartoum since South Sudan's independence, South Sudanese President Salva Kiir meets with Bashir to ""reach final solutions"" to address continuing differences between their countries.October 31, 2011 - Government officials announce that Sudanese troops have killed hundreds of rebel fighters during a battle in the border province of Southern Kordofan.January 23, 2012 - South Sudan shuts down oil production after accusing Sudan of stealing $815 million of its oil. Sudan says it confiscated the crude to make up for unpaid fees to use the pipeline and processing facilities in its territory.January 24, 2012 - According to Office of the UN High Commissioner for Refugees, more than 78,000 people have fled Sudan's South Kordofan and Blue Nile states since August of last year.February 10, 2012 - During talks mediated by the African Union, Sudan and South Sudan sign a nonaggression pact aimed at bringing peace to the border region.April 12, 2012 - South Sudan forces claim the oil fields in the town of Heglig, which account for about half of Sudan's oil production.April 20, 2012 - South Sudan announces the withdrawal of its troops from the contested, oil-rich area of Heglig. Sudan claims that the South Sudan troops were ""forced to withdraw.""April 29, 2012 - Bashir declares a state of emergency for cities in the provinces of South Kordofan, White Nile and Sinnar, which are on the eastern half of its border with South Sudan.September 27, 2012 - Bashir and Kiir sign a deal to resume oil exports and establish a demilitarized zone and principles of border demarcation, but do not reach a deal on the status of Abyei, a disputed region claimed by both countries.January 6, 2013 - Bashir and Kiir agree to temporary arrangements for the oil-rich Abyei region. March 8, 2013 - Defense ministers from Sudan and South Sudan sign an agreement to soon withdraw their respective military forces from the demilitarized zone between the countries.April 6, 2013 - A splinter group from the Justice and Equality Movement, the largest Darfurian rebel group, signs a peace agreement based on the Doha Document for Peace in Darfur with the Sudanese government.April 9, 2013 - Countries pledge $3.7 billion at a conference in Doha, Qatar, for the reconstruction and development of Darfur.January 6, 2014 - Bashir travels to South Sudan for talks with Kiir. Unrest in South Sudan has left more than 1,000 people dead and cut South Sudan's oil output, affecting the economies of both countries.February 1, 2014 - The International Committee of the Red Cross says that Sudanese authorities have ordered the Red Cross to halt its activities in the Sudan, citing technical reasons. The International Committee of the Red Cross says it has worked in Sudan for 36 years.January 28, 2016 - Bashir orders the opening of the border with South Sudan for the first time since the South seceded five years ago, Sudan's state news agency reports.September 29, 2016 - The Sudanese government is accused of using chemical weapons against the people of Darfur, according to a report released by Amnesty International. According to the organization, up to 250 people have been killed by chemical weapons since the Sudanese military campaign began in January.October 12, 2017 - The US Treasury lifts various economic sanctions against Sudan. It will remain subject to separate United Nations Security Council sanctions related to its violent crackdown on opposition groups in Darfur, but will no longer be subject to a 20-year-old US trade embargo and will have access to previously frozen assets.February 22, 2019 - Bashir declares a year-long state of emergency in response to months of protests nationwide and calls for his resignation. The protests are organized by a group of professional unions including doctors, lawyers, teachers and students and supported by two of the largest opposition parties.April 11, 2019 - Bashir is arrested and forced from power in a military coup. The Transitional Military Council (TMC) assumes control for three years to oversee a transition of power.May 13, 2019 - Sudan's Public Prosecutor's Office has instructed expedited charges be bought against Bashir in the killing of protestors, according to a statement released to CNN.June 3, 2019 - Troops attack pro-democracy demonstrators in Khartoum, killing at least 100 people. June 4, 2019 - TMC leader Abdel Fattah al-Burhan calls for national elections within nine months.July 5, 2019 - Sudan's military leadership and the country's pro-democracy movement announce that a power-sharing agreement has been reached. Under the agreement, TMC will oversee the country's leadership for the first 21 months. A civilian administration will rule the council during the following 18 months. The joint sovereign council will consist of five members of the military and five civilians, in addition to one civilian chosen by consensus from both sides.August 17, 2019 - Members of Sudan's military leadership and the country's pro-democracy movement sign a power-sharing agreement.August 20, 2019 - Sudan's generals and opposition alliance form a sovereign council that will lead the country during the three-year transitional period until the next election. The head of TMC, Abdul Fattah al-Burhan, will lead the new 11-member council, according to TMC Spokesman Shams Al-Din Al Kabashi. Council members include two women -- one of them represents the opposition and the other is a neutral Christian member. Members of the council are sworn in the following day.December 14, 2019 - Bashir is sentenced to two years in a correctional facility after being found guilty of corruption and illegitimate possession of foreign currency.February 11, 2020 - A member of Sudan's ruling sovereign council announces that all Sudanese wanted by the ICC will be handed over, including Bashir.February 13, 2020 - Sudan agrees to pay a $30 million settlement to the families of 17 US Navy sailors killed in the 2000 bombing of the USS Cole in a bid to get itself removed from the United States' list of state sponsors of terrorism.May 1, 2020 - Sudan's government has criminalized female genital mutilation (FGM), a government spokesperson tells CNN, clamping down on a practice that most of the country's women and girls have endured. According to United Nations data around 88% of the female population in Sudan have suffered FGM, making it one of the world's most-affected nations.October 23, 2020 - US President Donald Trump announces that Sudan and Israel have agreed to normalize relations.December 14, 2020 - The US Embassy in Khartoum announces that the United States has lifted Sudan's state sponsor of terrorism designation. The two countries reached an agreement in October for Sudan to be removed from the list.March 31, 2021 - US Secretary of State Antony Blinken says in a statement that the United States has received the $335 million settlement from Sudan that will be paid out to victims and families of individuals impacted by the 1998 bombings at the US Embassies in Tanzania and Kenya, the 2000 attack on the USS Cole and the murder of a USAID employee in Khartoum. The multi-million dollar settlement was a key component in lifting Sudan's decades-old state sponsor of terrorism designation, which came with a series of restrictions including a ban on defense exports and sales and restrictions on US foreign assistance.September 21, 2021 - A military coup d'etat attempt, attributed to forces loyal to Bashir, fails, according to three senior government and military sources. Most of the officers involved, about 40, are arrested.October 25, 2021 - After months of rising tensions in the country, Sudan's military dissolves the transitional government in a coup and declares a state of emergency, catapulting the country into its biggest political crisis in its two-year-old transition. Prime Minister Abdalla Hamdok and multiple government ministers and officials are arrested. In a televised address, General Abdel Fattah al-Burhan says an ""independent and fair representative government"" will assume power until one is elected in 2023."" The takeover is condemned by the United States, the European Union, and the United Nations.",//cdn.cnn.com/cnnnext/dam/assets/190819112946-01-sudan-0817-small-169.jpg,https://edition.cnn.com/2013/10/30/world/africa/sudan-fast-facts/index.html,politics
79,Russian diplomat found dead on street outside Berlin embassy,"A Russian diplomat found dead on the sidewalk outside the embassy in Berlin last month is believed by German authorities to have been a secret agent for a Russian intelligence agency, Der Spiegel magazine reported Friday. The body of the 35-year-old diplomat was found on the morning of October 19; he apparently fell from an upper floor of the Russian embassy building in the German capital, though it was unclear why he fell or what the cause of death was, Der Spiegel reported. Der Spiegel and investigative site Bellingcat report that the dead diplomat had been accredited as second secretary at the Russian embassy in Berlin since 2019, but German security officials believe he was an undercover officer for Russia's FSB, the internal security and counterintelligence service, and that he was related to a high-ranking FSB officer.The FSB was previously linked by Western intelligence services to the murder of a Georgian exile who was shot dead in a Berlin park in 2019, Der Spiegel and Bellingcat reported. The Kremlin has denied any link between the killing and the Russian state. The Russian embassy did not agree to an autopsy of the diplomat, and the his diplomatic immunity meant that Germany's public prosecutor could not carry out an investigation, Der Spiegel reported Friday. Russian and German officials acknowledged the death of the diplomat on Friday following the Der Spiegel report. ""A tragic accident with a Russian diplomat occurred on October 19, 2021,"" the Russian embassy said in a statement. ""All the formalities related to sending the diplomat's body to his homeland were promptly settled with the competent law enforcement and medical authorities of Germany in accordance with the current practice.""""We consider the speculation that appeared in a number of Western media in the context of this tragic incident to be absolutely incorrect.""A spokeswoman at the German foreign ministry told CNN the government was aware of the death of the diplomat, but due to ""reasons of personal protection of the persons concerned and their relatives, no further details will be disclosed at this moment.""The death of the diplomat came nearly a year after an investigation by CNN and Bellingcat revealed that an FSB toxins team of about six to 10 agents trailed Russian opposition leader Alexey Navalny for more than three years before he was poisoned in August 2020 with the lethal nerve agent Novichok.One of the FSB agents was later duped into telling Navalny over the phone that the Novichok had been planted in his underpants -- a detail that emerged when Navalny posed as a member of Russia's National Security Council and called the agent to press him for details of the operation, as was revealed exclusively in another CNN-Bellingcat investigation. ",//cdn.cnn.com/cnnnext/dam/assets/211105102616-restricted-russian-embassy-berlin-germany-11-05-2021-small-169.jpg,https://edition.cnn.com/2021/11/05/europe/germany-russia-diplomat-berlin-embassy-dead-intl/index.html,politics
88,300 million-year-old fossil skeleton in Utah could be the first of its kind,"An approximately 300 million-year-old fossil skeleton discovered at Canyonlands National Park in Utah could be the first of its kind, researchers say. The exact species and classification have yet to be determined, but the fossil is a tetrapod -- meaning animal with four legs -- and could be an early ancestor of either reptiles or mammals. Paleontologists have determined the fossil could be anywhere from 295 million to 305 million years old, between the Pennsylvanian and the Permian geologic time periods.""It's a phenomenal specimen. You do not see something like that very often, so it's really significant for that in itself,"" said Adam Marsh, lead paleontologist at Petrified Forest National Park in Arizona. ""But what it indicates is that there's probably more fossils out there, especially at Canyonlands, in this really important time interval.""A team of scientists and paleontologists from Petrified Forest, the Natural History Museum of Utah and the University of Southern California helped collect the fossil from Canyonlands. The fossil was found as a complete skeleton, and the bones were in their ""life positions,"" meaning the same position as when the animal was alive. This fossil appears to be an early amniote, which is a land-living vertebrate that lays eggs, according to Adam Huttenlocker, an outside specialist on the team who researches early tetrapod fossils and is an assistant professor at USC. The complete skeleton allows scientists to analyze the evolution of amniotes, in addition to the ancestors of early reptiles and mammals.This area of Canyonlands hasn't produced amniote fossils in the ancient rock formation the fossil was found in, so Huttenlocker said there's a good chance this fossil represents a new species of early amniote.The fossil excavation of a lifetimeA park ranger at Canyonlands reported the fossil around October 2020. After the research permit was processed, the team collected the fossil a year later, on October 23 of this year. Matthew Van Scoyoc said this was the first time he's seen anyone apply for a research permit to extract a fossil in his four years as the research coordinator of the National Park Service's Southeast Utah Group, which includes Canyonlands. He coordinates research and provides permits for these parks, but excavating hasn't been a part of the job -- until now. ""I never thought I'd get to go on a fossil excavation in my life, and that was just really, really cool,"" Van Scoyoc said.The excavation took an entire day, Van Scoyoc said. The team hiked 13 miles roundtrip into the backcountry, extracted the fossil in two pieces and hiked back with a skeleton in their backpacks. (The fossil's original location, Lost Canyon, is designated as a wilderness area by the National Park Service, so no motorized vehicles were allowed.)The fossil is now at the Petrified Forest fossil preparation lab for tests and scans of the skeleton and skull. After scientists determine the species, which could take at least a year, Marsh said the fossil will remain with the National Park Service for further research and museum exhibits.There is a possibility that this fossil is a new species, which is rare -- Marsh said some paleontologists go their entire careers without a discovery of that kind. But even if the fossil turns out to be a known species, Marsh said this finding is still significant for understanding the biodiversity of that time.Fossil specimens from aquatic animals like shark spines are common finds at Canyonlands, especially along the river, but Huttenlocker said this is the first time he has been notified of a land-living vertebrate fossil.""This is a rare, once-in-a-lifetime opportunity for me,"" Huttenlocker said.'Scraping the surface'The fossil was at risk for erosion from rain and water, which is why Van Scoyoc said they issued the permit. Canyonlands does not have any paleontologists on staff, so they outsourced paleontologists from Petrified Forest, which is known for its fossils. ""Fossils themselves are probably not that rare in Canyonlands. It's just, we haven't looked for them thoroughly,"" Van Scoyoc said. ""What's happening now is we, as the National Park Service, are able to consider them more.""National park sites are full of undiscovered fossils, Marsh said. The collaboration between park staff and researchers from different parks and institutions is integral, he said, to their discovery.""We're just now scraping the surface about nuts-and-bolts paleontology,"" Marsh said.You can channel your inner paleontologist next time you're at a national park. Marsh said if you think you see a fossil -- don't try excavating it yourself -- send a picture and location to park staff.""This is exactly how we find things that we don't know about otherwise, because we're not always able to get out to certain areas all the time,"" Marsh said. ""It's helpful for folks to let us know what they see.""",//cdn.cnn.com/cnnnext/dam/assets/150103074330-hubble-space-background-2-small-169.jpg,https://edition.cnn.com/2021/11/05/world/fossil-skeleton-discovered-canyonlands-scn/index.html,politics
